{
    "SchemaVersion": 2,
    "Permissions": [
        {
            "Name": "Microsoft Graph",
            "Id": "00000003-0000-0000-c000-000000000000",
            "AppRoleAssignments": [
                {
                    "Value": "Policy.Read.All",
                    "Reason": "Fetches all Conditional Access policies to export them as JSON files"
                }
            ]
        }
    ],
    "Roles": [],
    "ManualPermissions": [
        "Azure IaaS: Access to the given Azure Storage Account / Resource Group"
    ]
}
