{
    "SchemaVersion": 2,
    "Permissions": [
        {
            "Name": "Office 365 Exchange Online",
            "Id": "00000002-0000-0ff1-ce00-000000000000",
            "AppRoleAssignments": [
                {
                    "Value": "Exchange.ManageAsApp",
                    "Reason": "Creates the shared mailbox and sets delegation and regional settings in the app-only Exchange Online session"
                }
            ]
        },
        {
            "Name": "Microsoft Graph",
            "Id": "00000003-0000-0000-c000-000000000000",
            "AppRoleAssignments": [
                {
                    "Value": "User.ReadWrite.All",
                    "Optional": true,
                    "Feature": "Disable user account",
                    "Reason": "Disables the mailbox's user account via PATCH /users/{id} when DisableUser is enabled (default on)"
                }
            ]
        }
    ],
    "Roles": [
        {
            "Name": "Exchange Administrator",
            "TemplateId": "29232cdf-9323-42fd-ade2-1d097af3e4de",
            "Reason": "Required for the app-only Exchange Online session creating the shared mailbox"
        }
    ],
    "ManualPermissions": []
}
