{
    "SchemaVersion": 2,
    "Permissions": [
        {
            "Name": "Microsoft Graph",
            "Id": "00000003-0000-0000-c000-000000000000",
            "AppRoleAssignments": [
                {
                    "Value": "AuditLog.Read.All",
                    "Reason": "Reads the service principal sign-in activity report for the last sign-in date of each application"
                },
                {
                    "Value": "Directory.Read.All",
                    "Reason": "Lists the service principals of all enterprise applications"
                },
                {
                    "Value": "Mail.Send",
                    "Optional": true,
                    "Feature": "Email report",
                    "Reason": "Sends the report email via Send-RjRbReportEmail when email delivery is selected"
                },
                {
                    "Value": "Organization.Read.All",
                    "Optional": true,
                    "Feature": "Email report",
                    "Reason": "Reads the tenant display name for the report email"
                }
            ]
        }
    ],
    "Roles": [],
    "ManualPermissions": [
        "Azure Storage Account: 'Reader and Data Access' role for the Automation Account's managed identity on the target storage account - the upload retrieves the account keys via listKeys (only required for the download link options)"
    ]
}
