{
    "SchemaVersion": 2,
    "Permissions": [
        {
            "Name": "Microsoft Graph",
            "Id": "00000003-0000-0000-c000-000000000000",
            "AppRoleAssignments": [
                {
                    "Value": "Group.ReadWrite.All",
                    "Reason": "Reads the group and patches displayName, mailNickname and description"
                }
            ]
        }
    ],
    "Roles": [],
    "ManualPermissions": []
}
