{
    "SchemaVersion": 2,
    "Permissions": [
        {
            "Name": "Microsoft Graph",
            "Id": "00000003-0000-0000-c000-000000000000",
            "AppRoleAssignments": [
                {
                    "Value": "DeviceManagementManagedDevices.Read.All",
                    "Reason": "Reads the managed device, its compliance policy states and per-policy setting states"
                },
                {
                    "Value": "Organization.Read.All",
                    "Reason": "Reads /organization for the tenant display name shown in the compliance report"
                },
                {
                    "Value": "Mail.Send",
                    "Optional": true,
                    "Feature": "Email report",
                    "Reason": "Sends the compliance report email via Send-RjReportEmail when EmailTo is configured"
                }
            ]
        }
    ],
    "Roles": [],
    "ManualPermissions": []
}
