{
    "SchemaVersion": 2,
    "Permissions": [
        {
            "Name": "Office 365 Exchange Online",
            "Id": "00000002-0000-0ff1-ce00-000000000000",
            "AppRoleAssignments": [
                {
                    "Value": "Exchange.ManageAsApp",
                    "Reason": "Manages Safe Links policies, rules and the assignment group in the app-only Exchange Online session"
                }
            ]
        }
    ],
    "Roles": [
        {
            "Name": "Exchange Administrator",
            "TemplateId": "29232cdf-9323-42fd-ade2-1d097af3e4de",
            "Reason": "Required for the app-only Exchange Online session updating DoNotRewriteUrls"
        }
    ],
    "ManualPermissions": []
}
