{
    "SchemaVersion": 2,
    "Permissions": [
        {
            "Name": "Microsoft Graph",
            "Id": "00000003-0000-0000-c000-000000000000",
            "AppRoleAssignments": [
                {
                    "Value": "Device.Read.All",
                    "Reason": "Looks up the device via /devices to check its OS and current enabled state"
                }
            ]
        }
    ],
    "Roles": [
        {
            "Name": "Cloud Device Administrator",
            "TemplateId": "7698a772-787b-4ac8-901f-60d6b08affd2",
            "Reason": "Required for the PATCH on /devices/{id} that enables or disables the device"
        }
    ],
    "ManualPermissions": []
}
