{
    "SchemaVersion": 2,
    "Permissions": [
        {
            "Name": "Microsoft Graph",
            "Id": "00000003-0000-0000-c000-000000000000",
            "AppRoleAssignments": [
                {
                    "Value": "Organization.Read.All",
                    "Reason": "Required by the app-based Teams PowerShell sign-in to read tenant information"
                },
                {
                    "Value": "Sites.Read.All",
                    "Reason": "Reads the TPI SharePoint lists with the locations to build the settings JSON"
                }
            ]
        }
    ],
    "Roles": [
        {
            "Name": "Teams Administrator",
            "TemplateId": "69091246-20e8-4a56-aa4d-066075b2a7a8",
            "Reason": "Required to read the voice routing, calling, voicemail and dial plan policies via Get-Cs cmdlets"
        }
    ],
    "ManualPermissions": []
}
