{
    "SchemaVersion": 2,
    "Permissions": [
        {
            "Name": "Microsoft Graph",
            "Id": "00000003-0000-0000-c000-000000000000",
            "AppRoleAssignments": [
                {
                    "Value": "Group.Read.All",
                    "Reason": "Reads the group and lists its owners via /groups/{id}/owners"
                },
                {
                    "Value": "User.Read.All",
                    "Reason": "Reads the owners' user properties (display name, UPN) returned by /groups/{id}/owners"
                }
            ]
        }
    ],
    "Roles": [],
    "ManualPermissions": []
}
